{"motion_version":"archify.motion.v1","diagram_type":"sequence","source":{"title":"Cache Miss Request","diagramId":"cache-miss-request"},"beats":[{"id":"request","label":"Request","startMs":0,"durationMs":500,"primitive":"edge-pulse","targets":{"nodes":["web","api"],"relationships":["dashboard-request"]},"state":"cache.requested"},{"id":"auth","label":"Authenticate","startMs":500,"durationMs":500,"primitive":"gate","targets":{"nodes":["api","auth"],"relationships":["verify-jwt"]},"state":"cache.authenticated"},{"id":"fallback","label":"Query source","startMs":1000,"durationMs":500,"primitive":"edge-pulse","targets":{"nodes":["api","db"],"relationships":["profile-query"]},"state":"cache.fallback"},{"id":"respond","label":"Return response","startMs":1500,"durationMs":500,"primitive":"callback","targets":{"nodes":["api","web"],"relationships":["dashboard-response"]},"state":"cache.responded"}],"assertions":[{"id":"request","atMs":250,"activeBeats":["request"],"activeNodes":["api","web"],"activeRelationships":["dashboard-request"],"states":["cache.requested"]},{"id":"fallback","atMs":1250,"activeBeats":["fallback"],"activeNodes":["api","db"],"activeRelationships":["profile-query"],"states":["cache.fallback"]},{"id":"respond","atMs":1750,"activeBeats":["respond"],"activeNodes":["api","web"],"activeRelationships":["dashboard-response"],"states":["cache.responded"]}]}
