{"motion_version":"archify.motion.v1","diagram_type":"workflow","source":{"title":"Agent Tool Call","diagramId":"agent-tool-call"},"beats":[{"id":"plan","label":"Plan the request","startMs":0,"durationMs":500,"primitive":"edge-pulse","targets":{"nodes":["chat","planner"],"relationships":["plan-request"]},"state":"agent.planned"},{"id":"approval","label":"Request approval","startMs":500,"durationMs":500,"primitive":"gate","targets":{"nodes":["approval","router"],"relationships":["approval-check"]},"state":"agent.approval_requested"},{"id":"execute","label":"Execute approved tool","startMs":1000,"durationMs":500,"primitive":"gate","targets":{"nodes":["approval","tool"],"relationships":["approved-tool"]},"state":"agent.tool_executing"},{"id":"return","label":"Return tool result","startMs":1500,"durationMs":500,"primitive":"callback","targets":{"nodes":["external","final"],"relationships":["external-reply"]},"state":"agent.result_returned"},{"id":"evidence","label":"Write evidence","startMs":2000,"durationMs":500,"primitive":"edge-pulse","targets":{"nodes":["external","trace"],"relationships":["record-result"]},"state":"agent.evidence_recorded"},{"id":"retry","label":"Route denied work to retry","startMs":2500,"durationMs":500,"primitive":"retry","targets":{"nodes":["blocked","retry"],"relationships":["retry-request"]},"state":"agent.retry_requested"}],"assertions":[{"id":"plan","atMs":250,"activeBeats":["plan"],"activeNodes":["chat","planner"],"activeRelationships":["plan-request"],"states":["agent.planned"]},{"id":"approval","atMs":750,"activeBeats":["approval"],"activeNodes":["approval","router"],"activeRelationships":["approval-check"],"states":["agent.approval_requested"]},{"id":"return","atMs":1750,"activeBeats":["return"],"activeNodes":["external","final"],"activeRelationships":["external-reply"],"states":["agent.result_returned"]},{"id":"retry","atMs":2750,"activeBeats":["retry"],"activeNodes":["blocked","retry"],"activeRelationships":["retry-request"],"states":["agent.retry_requested"]}]}
