{"motion_version":"archify.motion.v1","diagram_type":"dataflow","source":{"title":"Product Analytics","diagramId":"product-analytics"},"beats":[{"id":"collect","label":"Collect events","startMs":0,"durationMs":500,"primitive":"fanout","targets":{"nodes":["edge","mobile","web"],"relationships":["mobile-events","web-clickstream"]},"state":"analytics.collected"},{"id":"accept","label":"Accept policy-cleared events","startMs":500,"durationMs":500,"primitive":"gate","targets":{"nodes":["edge","stream"],"relationships":["accepted-events"]},"state":"analytics.accepted"},{"id":"curate","label":"Curate facts","startMs":1000,"durationMs":500,"primitive":"edge-pulse","targets":{"nodes":["stream","warehouse"],"relationships":["normalized-facts"]},"state":"analytics.curated"},{"id":"consume","label":"Serve dashboard","startMs":1500,"durationMs":500,"primitive":"fanout","targets":{"nodes":["dashboard","warehouse"],"relationships":["metrics-query"]},"state":"analytics.served"}],"assertions":[{"id":"collect","atMs":250,"activeBeats":["collect"],"activeNodes":["edge","mobile","web"],"activeRelationships":["mobile-events","web-clickstream"],"states":["analytics.collected"]},{"id":"curate","atMs":1250,"activeBeats":["curate"],"activeNodes":["stream","warehouse"],"activeRelationships":["normalized-facts"],"states":["analytics.curated"]}]}
