{"motion_version":"archify.motion.v1","diagram_type":"lifecycle","source":{"title":"Agent Run","diagramId":"agent-run"},"beats":[{"id":"start","label":"Start planning","startMs":0,"durationMs":500,"primitive":"edge-pulse","targets":{"nodes":["approval","executing"],"relationships":["approval-needed"]},"state":"run.planning"},{"id":"execute","label":"Execute tools","startMs":500,"durationMs":500,"primitive":"edge-pulse","targets":{"nodes":["blocked","reviewing"],"relationships":["review-blocked"]},"state":"run.executing"},{"id":"retry","label":"Retry failed work","startMs":1000,"durationMs":500,"primitive":"retry","targets":{"nodes":["executing","failed"],"relationships":["failed-retry"]},"state":"run.retrying"},{"id":"complete","label":"Complete review","startMs":1500,"durationMs":500,"primitive":"edge-pulse","targets":{"nodes":["cancelled","approval"],"relationships":["approval-cancelled"]},"state":"run.completed"}],"assertions":[{"id":"execute","atMs":750,"activeBeats":["execute"],"activeNodes":["blocked","reviewing"],"activeRelationships":["review-blocked"],"states":["run.executing"]},{"id":"retry","atMs":1250,"activeBeats":["retry"],"activeNodes":["executing","failed"],"activeRelationships":["failed-retry"],"states":["run.retrying"]}]}
