{"motion_version":"archify.motion.v1","diagram_type":"workflow","source":{"title":"Incident Response","diagramId":"incident-response"},"beats":[{"id":"page","label":"Page on-call","startMs":0,"durationMs":500,"primitive":"edge-pulse","targets":{"nodes":["alert","page"],"relationships":["alert-page"]},"state":"incident.paged"},{"id":"triage","label":"Triage impact","startMs":500,"durationMs":500,"primitive":"edge-pulse","targets":{"nodes":["page","triage"],"relationships":["page-triage"]},"state":"incident.triaged"},{"id":"contain","label":"Contain impact","startMs":1000,"durationMs":500,"primitive":"gate","targets":{"nodes":["contain","triage"],"relationships":["triage-contain"]},"state":"incident.contained"},{"id":"verify","label":"Verify recovery","startMs":1500,"durationMs":500,"primitive":"edge-pulse","targets":{"nodes":["recover","verify"],"relationships":["recover-verify"]},"state":"incident.verified"},{"id":"escalate","label":"Escalate specialists","startMs":2000,"durationMs":500,"primitive":"gate","targets":{"nodes":["escalate","update"],"relationships":["update-escalate"]},"state":"incident.escalated"},{"id":"rollback","label":"Rollback if unhealthy","startMs":2500,"durationMs":500,"primitive":"retry","targets":{"nodes":["rollback","verify"],"relationships":["verify-rollback"]},"state":"incident.rollback_started"}],"assertions":[{"id":"page","atMs":250,"activeBeats":["page"],"activeNodes":["alert","page"],"activeRelationships":["alert-page"],"states":["incident.paged"]},{"id":"contain","atMs":1250,"activeBeats":["contain"],"activeNodes":["contain","triage"],"activeRelationships":["triage-contain"],"states":["incident.contained"]},{"id":"escalate","atMs":2250,"activeBeats":["escalate"],"activeNodes":["escalate","update"],"activeRelationships":["update-escalate"],"states":["incident.escalated"]},{"id":"rollback","atMs":2750,"activeBeats":["rollback"],"activeNodes":["rollback","verify"],"activeRelationships":["verify-rollback"],"states":["incident.rollback_started"]}]}
